{
  "version": 1,
  "updatedAt": "2026-08-07T00:14:11Z",
  "baseline": [
    {
      "platform": "x",
      "capturedAt": "2026-07-31T19:53:41Z",
      "followers": 5,
      "source": "Owner-reported last-known count in the 2026-07-31 takeover task"
    },
    {
      "platform": "youtube",
      "capturedAt": "2026-07-31T19:53:41Z",
      "followers": null,
      "source": "Not yet measured"
    },
    {
      "platform": "x",
      "capturedAt": "2026-08-07T00:14:11Z",
      "followers": 6,
      "source": "Read-only official X profile observation recorded in operations/x-outreach-readiness-receipt.json"
    }
  ],
  "posts": []
}
